{
  "name": "Rotesmeer - Level 2",
  "description": "Häufige Arten",
  "speciesNames": [
    "Neoglyphidodon melas",
    "Synodus dermatogenys",
    "Acanthurus gahhm",
    "Scarus fuscopurpureus",
    "Synodus variegatus",
    "Amanses scopas",
    "Epinephelus tauvina",
    "Caranx melampygus",
    "Cephalopholis rogaa",
    "Mulloidichthys flavolineatus",
    "Grammistes sexlineatus",
    "Hologymnosus annulatus",
    "Naso hexacanthus",
    "Ostracion cubicum",
    "Cantherhines pardalis",
    "Cetoscarus bicolor",
    "Cheilodipterus quinquelineatus",
    "Pseudanthias taeniatus",
    "Plagiotremus rhinorhynchos",
    "Hemigymnus melapterus",
    "Carcharhinus longimanus",
    "Chaetodon larvatus",
    "Synanceia verrucosa",
    "Caesio varilineata",
    "Epinephelus fasciatus",
    "Chromis pembae",
    "Thalassoma lunare",
    "Odonus niger",
    "Paracheilinus octotaenia",
    "Cephalopholis sexmaculata",
    "Scarus psittacus",
    "Siganus rivulatus",
    "Stegastes lacrymatus",
    "Coris cuvieri",
    "Saurida gracilis",
    "Ecsenius aroni",
    "Lutjanus monostigma",
    "Coris variegata",
    "Amblyeleotris steinitzi",
    "Meiacanthus nigrolineatus",
    "Plectorhinchus gaterinus",
    "Cheilio inermis",
    "Lethrinus nebulosus",
    "Arothron hispidus",
    "Plectropomus marisrubri",
    "Canthigaster cyanospilota",
    "Hemigymnus sexfasciatus",
    "Pseudochromis olivaceus",
    "Aluterus scriptus",
    "Coris caudimacula",
    "Diodon hystrix",
    "Ecsenius gravieri",
    "Kyphosus cinerascens",
    "Eviota guttata",
    "Scorpaenopsis barbata",
    "Lethrinus borbonicus",
    "Papilloculiceps longiceps",
    "Cyclichthys spilostylus",
    "Ecsenius dentex",
    "Arothron stellatus",
    "Platax teira",
    "Plagiotremus townsendi",
    "Scarus ghobban",
    "Scorpaenopsis oxycephalus",
    "Sphyraena barracuda",
    "Scarus frenatus",
    "Bodianus axillaris",
    "Lethrinus mahsena",
    "Pterocaesio chrysozona",
    "Diploprion drachi",
    "Ecsenius midas",
    "Heniochus diphreutes",
    "Gymnothorax griseus",
    "Gobiodon citrinus",
    "Gymnosarda unicolor",
    "Gymnothorax flavimarginatus",
    "Corythoichthys flavofasciatus",
    "Turrum fulvoguttatum",
    "Caranx ignobilis",
    "Eviota marerubrum",
    "Gnatholepis caudimaculata",
    "Ostorhinchus cyanosoma",
    "Pseudochromis flavivertex",
    "Bryaninops natans",
    "Naso brevirostris",
    "Canthigaster margaritata",
    "Lutjanus fulviflamma",
    "Chelonia mydas",
    "Chlorurus genazonatus",
    "Pomacentrus albicaudatus",
    "Ptereleotris evides",
    "Stethojulis albovittata",
    "Lutjanus kasmira",
    "Siganus argenteus",
    "Amblyeleotris sungami",
    "Oxycheilinus mentalis",
    "Pardachirus marmoratus",
    "Taeniamia fucata",
    "Eviota punyit",
    "Anampses lineatus",
    "Koumansetta hoesei",
    "Istigobius decoratus",
    "Pristiapogon kallopterus",
    "Ferdauia ferdau",
    "Trimma avidori",
    "Eretmochelys imbricata",
    "Macropharyngodon marisrubri",
    "Ostorhinchus nigrofasciatus",
    "Cheilodipterus lachneri",
    "Exallias brevis",
    "Halichoeres scapularis",
    "Chromis trialpha",
    "Cirrhitichthys oxycephalus",
    "Echeneis naucrates",
    "Malacanthus latovittatus",
    "Novaculichthys taeniourus",
    "Scomberoides lysan",
    "Ecsenius nalolo",
    "Sphyraena qenie",
    "Pomacentrus trilineatus",
    "Trimma flavicaudatum",
    "Amblygobius albimaculatus",
    "Bothus pantherinus",
    "Parupeneus rubescens",
    "Calloplesiops altivelis",
    "Pristiapogon exostigma",
    "Pseudobalistes flavimarginatus",
    "Halichoeres marginatus",
    "Lotilia graciliosa",
    "Pempheris tominagai",
    "Pervagor randalli",
    "Caranx sexfasciatus",
    "Pempheris adusta",
    "Canthigaster pygmaea",
    "Gymnothorax undulatus",
    "Acanthaster planci",
    "Anampses caeruleopunctatus",
    "Epibulus brevis",
    "Plectroglyphidodon leucozonus",
    "Apolemichthys xanthotis",
    "Scorpaenopsis diabolus",
    "Inimicus filamentosus",
    "Myripristis xanthacra",
    "Pleurosicya micheli",
    "Acanthopagrus bifasciatus",
    "Lethrinus microdon",
    "Mobula birostris",
    "Cheilodipterus pygmaios",
    "Kyphosus bigibbus",
    "Paracaesio sordida",
    "Sphyrna lewini",
    "Gnatholepis anjerensis",
    "Sargocentron marisrubri",
    "Tylosurus choram",
    "Triaenodon obesus",
    "Pomacanthus asfur",
    "Xenia umbellata"
  ],
  "imageUrl": "https://upload.wikimedia.org/wikipedia/commons/thumb/2/27/Red_Sea_37.95521E_21.41271N.jpg/330px-Red_Sea_37.95521E_21.41271N.jpg",
  "sources": [
    {
      "name": "REEF",
      "url": "https://www.reef.org/"
    },
    {
      "name": "FishBase",
      "url": "https://www.fishbase.org/"
    },
    {
      "name": "SeaLifeBase",
      "url": "https://www.sealifebase.org/"
    },
    {
      "name": "ChatGPT",
      "url": "https://openai.com/chatgpt"
    }
  ],
  "sourceId": "84fef7d3-e639-46ea-923c-7c0ae055a9ba"
}
