{
  "name": "Rotesmeer - Level 3",
  "description": "Seltene Arten",
  "speciesNames": [
    "Malacanthus brevirostris",
    "Valenciennea puellaris",
    "Gerres oyena",
    "Kyphosus vaigiensis",
    "Sebastapistes cyanostigma",
    "Blenniella periophthalmus",
    "Cirrhilabrus rubriventralis",
    "Cryptocentrus caeruleopunctatus",
    "Coris formosa",
    "Fusigobius neophytus",
    "Gorgasia sillneri",
    "Oxycirrhites typus",
    "Pleurosicya mossambica",
    "Rastrelliger kanagurta",
    "Stegastes nigricans",
    "Cephalopholis oligosticta",
    "Chrysiptera unimaculata",
    "Enneapterygius qirmiz",
    "Lethrinus xanthochilus",
    "Naucrates ductor",
    "Pastinachus sephen",
    "Alloblennius pictus",
    "Canthigaster valentini",
    "Ctenogobiops crocineus",
    "Lethrinus obsoletus",
    "Parupeneus heptacantha",
    "Chaetodon mesoleucos",
    "Chaetodon pictus",
    "Neopomacentrus xanthurus",
    "Aspidontus dussumieri",
    "Cirrhitus pinnulatus",
    "Elagatis bipinnulata",
    "Hemiramphus far",
    "Plotosus lineatus",
    "Ecsenius frontalis",
    "Pomacentrus aquilus",
    "Aetobatus ocellatus",
    "Carcharhinus amblyrhynchos",
    "Decapterus macarellus",
    "Gnathanodon speciosus",
    "Gymnothorax nudivomer",
    "Nectamia annularis",
    "Oxymonacanthus halli",
    "Taeniamia bilineata",
    "Paracaesio xanthurus",
    "Scarus collana",
    "Dendrochirus hemprichi",
    "Diplodus noct",
    "Hologymnosus doliatus",
    "Neopomacentrus cyanomos",
    "Plectropomus areolatus",
    "Pseudochromis dixurus",
    "Torpedo panthera",
    "Antennarius commerson",
    "Himantura uarnak",
    "Iniistius pavo",
    "Vanderhorstia delagoae",
    "Abudefduf sordidus",
    "Cheilodipterus novemstriatus",
    "Diodon liturosus",
    "Fusigobius longispinus",
    "Lethrinus harak",
    "Ptarmus gallus",
    "Ptereleotris heteroptera",
    "Tetrosomus gibbosus",
    "Thunnus albacares",
    "Wetmorella nigropinnata",
    "Canthidermis macrolepis",
    "Chromis pelloura",
    "Dunckerocampus multiannulatus",
    "Euthynnus affinis",
    "Gerres longirostris",
    "Lutjanus quinquelineatus",
    "Myrichthys maculosus",
    "Tylosurus crocodilus",
    "Callechelys marmorata",
    "Diagramma pictum",
    "Gobiodon rivulatus",
    "Grammatorcynus bilineatus",
    "Gymnocranius grandoculis",
    "Gymnothorax buroensis",
    "Lutjanus argentimaculatus",
    "Ostorhinchus fleurieu",
    "Pristotis cyanostigma",
    "Pteragogus cryptus",
    "Thalassoma purpureum",
    "Caranx lugubris",
    "Epinephelus polyphekadion",
    "Istigobius ornatus",
    "Trachinotus blochii",
    "Arothron immaculatus",
    "Atrosalarias fuscus",
    "Epinephelus malabaricus",
    "Lactoria fornasini",
    "Leptoscarus vaigiensis",
    "Mobula alfredi",
    "Oxymonacanthus longirostris",
    "Paraluteres arqat",
    "Pomacentrus leptus",
    "Pterois radiata",
    "Salarias fasciatus",
    "Scuticaria tigrina",
    "Siphamia tubifer",
    "Terapon jarbua",
    "Trimma filamentosum",
    "Alopias pelagicus",
    "Anyperodon leucogrammicus",
    "Chanos chanos",
    "Corythoichthys schultzi",
    "Cryptocentrus lutheri",
    "Epinephelus summana",
    "Eurypegasus draconis",
    "Eviota sebreei",
    "Gymnothorax pictus",
    "Iniistius pentadactylus",
    "Lutjanus biguttatus",
    "Lutjanus gibbus",
    "Macolor macularis",
    "Oplopomus oplopomus",
    "Pristiapogon fraenatus",
    "Ptereleotris microlepis",
    "Pterois mombasae",
    "Scarus rubroviolaceus",
    "Scomberoides commersonnianus",
    "Sphyraena flavicauda",
    "Thalassoma lutescens",
    "Trachyrhamphus bicoarctatus",
    "Vanderhorstia ambanoro",
    "Vanderhorstia mertensi",
    "Vanderhorstia ornatissima",
    "Acanthopagrus berda",
    "Acanthurus mata",
    "Asterropteryx semipunctata",
    "Atherinomorus lacunosus",
    "Bryaninops yongei",
    "Cheilodipterus arabicus",
    "Cirripectes filamentosus",
    "Eviota prasina",
    "Monodactylus argenteus",
    "Moolgarda heterocheilos",
    "Myrichthys colubrinus",
    "Pempheris vanicolensis",
    "Plectropomus pessuliferus",
    "Pseudochromis pesi",
    "Remora remora",
    "Sargocentron rubrum",
    "Sphyraena obtusata",
    "Stephanolepis diaspros",
    "Torpedo sinuspersici",
    "Valenciennea sexguttata",
    "Abantennarius coccineus",
    "Amblygobius nocturnus",
    "Amphiprion sebae",
    "Aspidontus taeniatus",
    "Brotula multibarbata",
    "Bryaninops ridens",
    "Caranx heberi",
    "Carcharhinus falciformis",
    "Chaetodon melapterus",
    "Chromis xanthopterygia",
    "Cyclichthys orbicularis",
    "Echidna nebulosa",
    "Epinephelus geoffroyi",
    "Fusigobius humeralis",
    "Gunnellichthys monostigma",
    "Halichoeres nebulosus",
    "Lactoria cornuta",
    "Macropharyngodon bipartitus",
    "Mimoblennius cirrosus",
    "Nectamia fusca",
    "Paragobiodon echinocephalus",
    "Parapriacanthus ransonneti",
    "Petroscirtes mitratus",
    "Plectorhinchus sordidus",
    "Plectranthias winniensis",
    "Ptereleotris zebra",
    "Soleichthys dori",
    "Taeniurops meyeni",
    "Torquigener flavimaculosus",
    "Trimma taylori",
    "Acanthurus dussumieri",
    "Aetomylaeus vespertilio",
    "Alepes vari",
    "Amblyeleotris wheeleri",
    "Amblypomacentrus annulatus",
    "Apogon crassiceps",
    "Blenniella chrysospilos",
    "Bodianus opercularis",
    "Bryaninops loki",
    "Caesio teres",
    "Chaetodon lunula",
    "Chilomycterus reticulatus",
    "Chlidichthys auratus",
    "Coryphaena hippurus",
    "Ctenogobiops maculosus",
    "Cyprinocirrhites polyactis",
    "Dendrochirus brachypterus",
    "Dendrochirus zebra",
    "Diodon holocanthus",
    "Drepane longimana",
    "Enneapterygius altipinnis",
    "Epinephelus areolatus",
    "Epinephelus fuscoguttatus",
    "Glaucostegus halavi",
    "Gobiodon histrio",
    "Gobiodon reticulatus",
    "Gunnellichthys viridescens",
    "Halichoeres lapillus",
    "Helcogramma steinitzi",
    "Hemigymnus fasciatus",
    "Hippocampus jayakari",
    "Lutjanus sapphirolineatus",
    "Lutjanus sebae",
    "Naso vlamingii",
    "Nectamia zebrina",
    "Neopomacentrus sindensis",
    "Ostorhinchus pselion",
    "Parupeneus indicus",
    "Pempheris schwenkii",
    "Photoblepharon steinitzi",
    "Plicomugil labiosus",
    "Pomacentrus arabicus",
    "Pseudochromis aldabraensis",
    "Psilogobius randalli",
    "Ptereleotris arabica",
    "Rhabdamia nigrimentum",
    "Rhincodon typus",
    "Sargocentron melanospilos",
    "Sargocentron punctatissimum",
    "Sargocentron tiere",
    "Scomberomorus commerson",
    "Solenostomus cyanopterus",
    "Stegostoma tigrinum",
    "Stethojulis interrupta",
    "Syngnathoides biaculeatus",
    "Taeniamia lineolata",
    "Trichonotus nikii",
    "Urogymnus asperrimus",
    "Verulux cypselurus",
    "Zapogon evermanni",
    "Zoramia leptacanthus",
    "Alloblennius jugularis",
    "Apogonichthyoides taeniatus",
    "Aprion virescens",
    "Callionymus delicatulus",
    "Cryptocentrus cryptocentrus",
    "Diplogrammus randalli",
    "Discordipinna griessingeri",
    "Dunckerocampus boylei",
    "Ellochelon vaigiensis",
    "Fusigobius inframaculatus",
    "Haliophis guttatus",
    "Parupeneus margaritatus",
    "Platax boersii",
    "Priolepis cincta",
    "Pteragogus flagellifer",
    "Stegastes albifasciatus",
    "Trimma mendelssohni",
    "Trimma striatum",
    "Bolbometopon muricatum",
    "Platax orbicularis",
    "Gymnomuraena zebra"
  ],
  "imageUrl": "https://upload.wikimedia.org/wikipedia/commons/thumb/2/27/Red_Sea_37.95521E_21.41271N.jpg/330px-Red_Sea_37.95521E_21.41271N.jpg",
  "sources": [
    {
      "name": "REEF",
      "url": "https://www.reef.org/"
    },
    {
      "name": "FishBase",
      "url": "https://www.fishbase.org/"
    },
    {
      "name": "SeaLifeBase",
      "url": "https://www.sealifebase.org/"
    },
    {
      "name": "ChatGPT",
      "url": "https://openai.com/chatgpt"
    }
  ],
  "sourceId": "6d55ef16-167d-4519-9e76-cb7ac0da3f74"
}
