{
  "name": "Mittelmeer - Level 2",
  "description": "Häufige Arten",
  "speciesNames": [
    "Scorpaena maderensis",
    "Seriola dumerili",
    "Octopus vulgaris",
    "Sphyraena viridensis",
    "Gobius incognitus",
    "Sabella spallanzanii",
    "Trachinotus ovatus",
    "Caranx crysos",
    "Bothus podas",
    "Muraena helena",
    "Tripterygion delaisi",
    "Tripterygion melanurus",
    "Paracentrotus lividus",
    "Belone belone",
    "Ophidiaster ophidianus",
    "Atherina presbyter",
    "Symphodus mediterraneus",
    "Synodus saurus",
    "Pagellus acarne",
    "Xyrichtys novacula",
    "Dardanus calidus",
    "Centrostephanus longispinus",
    "Codium elisabethae",
    "Epinephelus costae",
    "Spicara maena",
    "Uranoscopus scaber",
    "Serranus cabrilla",
    "Parablennius rouxi",
    "Scorpaena scrofa",
    "Tripterygion tripteronotum",
    "Gobius geniporus",
    "Symphodus rostratus",
    "Trachinus draco",
    "Gobius cobitis",
    "Parablennius sanguinolentus",
    "Scartella cristata",
    "Seriola rivoliana",
    "Serranus hepatus",
    "Sphaerechinus granularis",
    "Chromis limbata",
    "Coscinasterias tenuispina",
    "Ellisolandia elongata",
    "Hippocampus guttulatus",
    "Holothuria sanctori",
    "Conger conger",
    "Spicara smaris",
    "Labrus viridis",
    "Pagellus erythrinus",
    "Chelon auratus",
    "Dicentrarchus punctatus"
  ],
  "imageUrl": "https://images.pexels.com/photos/1200289/pexels-photo-1200289.jpeg",
  "sources": [
    {
      "name": "REEF",
      "url": "https://www.reef.org/"
    }
  ]
}