{
  "name": "Kanare Madeira Azoren - Level 3",
  "description": "Seltene Arten",
  "speciesNames": [
    "Seriola dumerili",
    "Heteropriacanthus cruentatus",
    "Pagrus pagrus",
    "Parablennius incognitus",
    "Trachurus picturatus",
    "Maja brachydactyla",
    "Pomatoschistus pictus",
    "Xyrichtys novacula",
    "Alicia mirabilis",
    "Holothuria mammata",
    "Lipophrys trigloides",
    "Kyphosus vaigiensis",
    "Scorpaena canariensis",
    "Serranus cabrilla",
    "Aurelia aurita",
    "Gymnothorax miliaris",
    "Scorpaena notata",
    "Synodus synodus",
    "Aplysia fasciata",
    "Clavelina lepadiformis",
    "Diplodus puntazzo",
    "Gymnura altavela",
    "Mobula tarapacana",
    "Pomatomus saltatrix",
    "Thorogobius ephippiatus",
    "Chromis chromis",
    "Odontaspis ferox",
    "Sarda sarda",
    "Sparus aurata",
    "Diplodus annularis",
    "Lithognathus mormyrus",
    "Remora remora",
    "Gobius niger",
    "Mullus barbatus",
    "Mycteroperca rubra",
    "Parablennius goreensis",
    "Torpedo marmorata",
    "Chelonia mydas",
    "Dicentrarchus labrax",
    "Parablennius parvicornis",
    "Scorpaena scrofa",
    "Serranus scriba",
    "Caloria elegans",
    "Palinurus elephas",
    "Abudefduf hoefleri",
    "Ammodytes tobianus",
    "Atherina presbyter",
    "Dasyatis tortonesei",
    "Gaidropsarus mediterraneus",
    "Labrisomus nuchipinnis",
    "Labrus merula",
    "Lepadogaster candolii",
    "Mauligobius maderensis",
    "Merluccius merluccius",
    "Naucrates ductor",
    "Pagellus erythrinus",
    "Parablennius gattorugine",
    "Prionace glauca",
    "Psenes pellucidus",
    "Raja brachyura",
    "Rhincodon typus",
    "Sardinella maderensis",
    "Scartella cristata",
    "Scarus hoefleri",
    "Scorpaena porcus",
    "Sphyraena pinguis",
    "Stephanolepis hispida",
    "Symphodus cinereus",
    "Mobula birostris"
  ],
  "imageUrl": "https://commons.wikimedia.org/wiki/File:Macaronesia_location_es.svg",
  "sources": [
    {
      "name": "REEF",
      "url": "https://www.reef.org/"
    },
    {
      "name": "FishBase",
      "url": "https://www.fishbase.org/"
    },
    {
      "name": "SeaLifeBase",
      "url": "https://www.sealifebase.org/"
    },
    {
      "name": "ChatGPT",
      "url": "https://openai.com/chatgpt"
    }
  ]
}