{
  "name": "Indian Ocean Red Sea - Level 1",
  "description": "Sehr häufige Arten",
  "speciesNames": [
    "Labroides dimidiatus",
    "Zanclus cornutus",
    "Gomphosus caeruleus",
    "Cephalopholis argus",
    "Chaetodon auriga",
    "Chlorurus sordidus",
    "Chaetodon trifasciatus",
    "Pseudanthias squamipinnis",
    "Pygoplites diacanthus",
    "Zebrasoma desjardinii",
    "Canthigaster valentini",
    "Pycnochromis fieldi",
    "Halichoeres hortulanus",
    "Parupeneus barberinus",
    "Balistapus undulatus",
    "Caranx melampygus",
    "Pomacanthus imperator",
    "Centropyge multispinis",
    "Pomacentrus caeruleus",
    "Scarus niger",
    "Amblyglyphidodon indicus",
    "Chaetodon kleinii",
    "Dascyllus trimaculatus",
    "Cephalopholis miniata",
    "Abudefduf sexfasciatus",
    "Naso elegans",
    "Abudefduf vaigiensis",
    "Chaetodon trifascialis",
    "Chromis viridis",
    "Siganus stellatus",
    "Monotaxis grandoculis",
    "Plectorhinchus vittatus",
    "Acanthurus leucosternon",
    "Chaetodon guttatissimus",
    "Dascyllus aruanus",
    "Pomacentrus sulfureus",
    "Pterois miles",
    "Sargocentron caudimaculatum",
    "Fistularia commersonii",
    "Paracirrhites forsteri",
    "Thalassoma lunare",
    "Zebrasoma scopas",
    "Ctenochaetus striatus",
    "Odonus niger",
    "Forcipiger flavissimus",
    "Lethrinus obsoletus",
    "Epibulus insidiator",
    "Labroides bicolor",
    "Lethrinus harak",
    "Lutjanus bohar",
    "Pomacanthus semicirculatus",
    "Scolopsis frenata",
    "Siganus puelloides",
    "Sufflamen bursa",
    "Chaetodon xanthocephalus",
    "Stegastes lacrymatus",
    "Balistoides viridescens",
    "Cephalophlis rogaa",
    "Scarus prasiognathos",
    "Bodianus axillaris",
    "Gymnothorax javanicus",
    "Naso brevirostris",
    "Apolemichthys trimaculatus",
    "Chaetodon falcula",
    "Cheilinus trilobatus",
    "Chromis ternatensis",
    "Coris formosa",
    "Hemigymnus fasciatus",
    "Melichthys indicus",
    "Ptereleotris evides",
    "Pterocaesio tile",
    "Sargocentron spiniferum",
    "Scarus ghobban",
    "Sufflamen chrysopterum",
    "Chaetodon lunula",
    "Cheilodipterus macrodon",
    "Ctenochaetus truncatus",
    "Lutjanus fulviflamma",
    "Parupeneus macronemus",
    "Pycnochromis dimidiatus",
    "Scolopsis bilineata",
    "Chlorurus strongylocephalus",
    "Dascyllus carneus",
    "Hemigymnus melapterus",
    "Lutjanus gibbus",
    "Naso vlamingii",
    "Siganus argenteus",
    "Variola louti",
    "Anyperodon leucogrammicus",
    "Cheilinus fasciatus",
    "Hemitaurichthys zoster",
    "Acanthurus nigricauda",
    "Cheilinus undulatus",
    "Mulloidichthys flavolineatus",
    "Priacanthus hamrur",
    "Pseudanthias taeniatus",
    "Amphiprion clarkii",
    "Macolor macularis",
    "Macolor niger",
    "Nemateleotris magnifica",
    "Pomacentrus xanthocercus",
    "Rhinecanthus assasi",
    "Triaenodon obesus",
    "Bodianus diana",
    "Chaetodon madagaskariensis",
    "Chaetodon meyeri",
    "Cheilio inermis"
  ],
  "imageUrl": "https://www.reef.org/sites/all/modules/custom/reef_zones/images/iors.jpg",
  "sources": [
    {
      "name": "REEF",
      "url": "https://www.reef.org/"
    }
  ]
}