{
  "name": "Indischer Ozean: Malediven, Madagaskar, Seychellen - Level 2",
  "description": "Reef: IORS Regions 2 and 6",
  "speciesNames": [
    "Parapercis hexophtalma",
    "Halichoeres scapularis",
    "Heniochus monoceros",
    "Sargocentron diadema",
    "Chaetodon lunula",
    "Priacanthus hamrur",
    "Epinephelus spilotoceps",
    "Thalassoma jansenii",
    "Halichoeres vrolikii",
    "Cheilinus undulatus",
    "Epibulus insidiator",
    "Ecsenius lineatus",
    "Meiacanthus smithi",
    "Parupeneus cyclostomus",
    "Hemigymnus melapterus",
    "Plectropomus laevis",
    "Ostracion meleagris",
    "Pterois miles",
    "Stethojulis albovittata",
    "Chaetodon melannotus",
    "Cheilinus fasciatus",
    "Chromis opercularis",
    "Labrichthys unilineatus",
    "Synodus variegatus",
    "Acanthurus lineatus",
    "Coris formosa",
    "Aulostomus chinensis",
    "Myripristis murdjan",
    "Siganus corallinus",
    "Acanthurus xanthopterus",
    "Scarus scaber",
    "Acanthurus mata",
    "Plagiotremus phenax",
    "Cephalopholis spiloparaea",
    "Scarus prasiognathos",
    "Chaetodon citrinellus",
    "Cheilinus trilobatus",
    "Gymnosarda unicolor",
    "Cheilodipterus quinquelineatus",
    "Epinephelus fasciatus",
    "Gymnothorax flavimarginatus",
    "Aluterus scriptus",
    "Arothron meleagris",
    "Epinephelus merra",
    "Canthigaster janthinoptera",
    "Aetobatus ocellatus",
    "Acanthurus leucocheilus",
    "Acanthurus triostegus",
    "Pomacentrus nagasakiensis",
    "Scarus ghobban",
    "Lethrinus erythracanthus",
    "Acanthurus auranticavus",
    "Heteroconger hassi",
    "Parupeneus pleurostigma",
    "Koumansetta hectori",
    "Neoniphon sammara",
    "Azurina lepidolepis",
    "Ferdauia ferdau",
    "Platax orbicularis",
    "Pterocaesio lativittata",
    "Coris cuvieri",
    "Echeneis naucrates",
    "Naso brachycentron",
    "Scolopsis aurata",
    "Cantherhines pardalis",
    "Eviota zebrina",
    "Nemanthias carberryi",
    "Siganus puelloides",
    "Novaculichthys taeniourus",
    "Pseudobalistes flavimarginatus",
    "Chaetodon lineolatus",
    "Pycnochromis flavipectoralis",
    "Acanthurus tennentii",
    "Macolor niger",
    "Ptereleotris heteroptera",
    "Scorpaenopsis oxycephalus",
    "Amblyeleotris steinitzi",
    "Gnatholepis anjerensis",
    "Aphareus furca",
    "Azurina elerae",
    "Malacanthus latovittatus",
    "Siganus argenteus",
    "Taeniamia fucata",
    "Ostorhinchus angustatus",
    "Epinephelus polyphekadion",
    "Lethrinus obsoletus",
    "Paraluteres prionurus",
    "Plectroglyphidodon dickii",
    "Ecsenius midas",
    "Parapriacanthus ransonneti",
    "Kyphosus cinerascens",
    "Myripristis botche",
    "Pseudocheilinus evanidus",
    "Synodus jaculum",
    "Pempheris vanicolensis",
    "Pomacanthus semicirculatus",
    "Abudefduf sexfasciatus",
    "Acanthaster planci",
    "Caranx sexfasciatus",
    "Chaetodon bennetti",
    "Epibulus brevis",
    "Taeniurops meyeni",
    "Apolemichthys xanthurus",
    "Elagatis bipinnulata",
    "Naso thynnoides",
    "Arothron hispidus",
    "Lethrinus harak",
    "Valenciennea strigata",
    "Plectorhinchus chaetodonoides",
    "Pristiapogon fraenatus",
    "Diodon hystrix",
    "Halichoeres marginatus",
    "Chaetodon interruptus",
    "Istigobius decoratus",
    "Amblyeleotris wheeleri",
    "Calloplesiops altivelis",
    "Cheilinus oxycephalus",
    "Chromis atripectoralis",
    "Epinephelus coeruleopunctatus",
    "Scarus caudofasciatus",
    "Gracila albomarginata",
    "Gymnocaesio gymnoptera",
    "Hologymnosus annulatus",
    "Mulloidichthys vanicolensis",
    "Scarus russelii",
    "Synodus dermatogenys",
    "Aprion virescens",
    "Arothron mappa",
    "Canthigaster petersii",
    "Naso unicornis",
    "Paracheilinus mccoskeri",
    "Pterocaesio trilineata",
    "Caranx ignobilis",
    "Gymnothorax favagineus",
    "Pleurosicya micheli",
    "Pycnochromis dimidiatus",
    "Caesio caerulaurea",
    "Cheilinus chlorourus",
    "Fusigobius duospilus",
    "Lutjanus biguttatus",
    "Chaetodon oxycephalus",
    "Cheilodipterus artus",
    "Malacanthus brevirostris",
    "Pycnochromis delta",
    "Cantherhines dumerilii",
    "Epinephelus macrospilos",
    "Lutjanus fulviflamma",
    "Plectropomus areolatus",
    "Trimma flammeum",
    "Halichoeres nebulosus",
    "Acanthurus tristis",
    "Amblyeleotris aurora",
    "Bolbometopon muricatum",
    "Chrysiptera biocellata",
    "Pempheris adusta",
    "Plectorhinchus gibbosus",
    "Chlidichthys inornatus",
    "Pateobatis fai",
    "Pristiapogon kallopterus",
    "Pseudobalistes fuscus",
    "Synanceia verrucosa",
    "Amphiprion sebae",
    "Anampses lineatus",
    "Taenianotus triacanthus",
    "Cirripectes auritus",
    "Gymnothorax undulatus",
    "Halichoeres zeylonicus",
    "Kyphosus vaigiensis",
    "Lutjanus ehrenbergii",
    "Lutjanus fulvus",
    "Sargocentron violaceum",
    "Trimma anaima",
    "Valenciennea sexguttata",
    "Cephalopholis sonnerati",
    "Mulloidichthys flavolineatus",
    "Naso lituratus",
    "Scarus viridifucatus",
    "Thalassoma quinquevittatum",
    "Trachinotus baillonii",
    "Lethrinus olivaceus",
    "Lutjanus bengalensis",
    "Oxycirrhites typus",
    "Caranx lugubris",
    "Gymnothorax thyrsoideus",
    "Neoniphon argenteus",
    "Rhabdamia gracilis",
    "Amanses scopas",
    "Arothron stellatus",
    "Chlorurus capistratoides",
    "Dunckerocampus multiannulatus",
    "Lethrinus microdon",
    "Mobula birostris",
    "Neoniphon opercularis",
    "Pycnochromis nigrurus",
    "Rhinecanthus rectangulus",
    "Stethojulis strigiventer",
    "Synodus binotatus",
    "Trimma naudei",
    "Caracanthus madagascariensis",
    "Corythoichthys schultzi",
    "Echidna nebulosa",
    "Epinephelus ongus",
    "Melichthys niger",
    "Pseudocoris yamashiroi",
    "Pterois radiata",
    "Rhinecanthus assasi",
    "Sufflamen albicaudatum",
    "Verulux cypselurus",
    "Carcharhinus albimarginatus",
    "Labropsis xanthonota",
    "Paracanthurus hepatus",
    "Plectroglyphidodon leucozonus",
    "Scomberoides lysan",
    "Siganus sutor",
    "Sphyraena forsteri",
    "Acanthurus bariene",
    "Acanthurus gahhm",
    "Amblygobius semicinctus",
    "Caesio teres",
    "Canthidermis macrolepis",
    "Gorgasia maculata",
    "Rhincodon typus",
    "Sphyraena barracuda",
    "Gymnomuraena zebra",
    "Goniobranchus tinctorius",
    "Dugong dugon",
    "Halophila ovalis"
  ],
  "imageUrl": "https://upload.wikimedia.org/wikipedia/commons/e/eb/1_Maldives%2C_Indian_Ocean%2C_Asia.jpg",
  "sources": [
    {
      "name": "REEF",
      "url": "https://www.reef.org/"
    },
    {
      "name": "FishBase",
      "url": "https://www.fishbase.org/"
    },
    {
      "name": "SeaLifeBase",
      "url": "https://www.sealifebase.org/"
    },
    {
      "name": "ChatGPT",
      "url": "https://openai.com/chatgpt"
    }
  ],
  "createdBy": "Fabian Eberle"
}