{
  "name": "Kopffüßer",
  "description": "Kopffüßer sind intelligente Weichtiere wie Kraken, Sepien und Kalmare. Sie kommen in allen Weltmeeren vor und bewohnen Riffe, Seegraswiesen, Sandböden und das Freiwasser. Viele Arten sind häufige Begegnungen für Taucher in tropischen und gemäßigten Gewässern.",
  "imageUrl": "https://images.pexels.com/photos/9004403/pexels-photo-9004403.jpeg",
  "learningMode": "species",
  "nameType": "commonName",
  "reviewMode": "flip",
  "speciesNames": [
    "Octopus vulgaris",
    "Octopus cyanea",
    "Octopus cyaneus",
    "Octopus tetricus",
    "Octopus bimaculoides",
    "Octopus briareus",
    "Abdopus aculeatus",
    "Hapalochlaena lunulata",
    "Hapalochlaena maculosa",
    "Thaumoctopus mimicus",
    "Wunderpus photogenicus",
    "Sepia officinalis",
    "Sepia pharaonis",
    "Sepia latimanus",
    "Sepia apama",
    "Sepia bandensis",
    "Metasepia pfefferi",
    "Sepiola rondeletii",
    "Euprymna scolopes",
    "Euprymna berryi",
    "Loligo vulgaris",
    "Doryteuthis pealeii",
    "Uroteuthis duvaucelii",
    "Sepioteuthis lessoniana",
    "Sepioteuthis sepioidea",
    "Illex illecebrosus",
    "Todarodes pacificus",
    "Dosidicus gigas"
  ],
  "sourceId": "8bfbfa51-7b8f-40f5-9f93-f13053e16e20"
}
