{
  "name": "Haie und Rochen",
  "description": "Haie und Rochen gehören zu den Knorpelfischen und kommen in allen Weltmeeren vor. Sie bewohnen Korallenriffe, Küstengewässer, Sandböden und das offene Meer. Viele Arten sind bekannte Begegnungen für Taucher in tropischen und gemäßigten Regionen.",
  "imageUrl": "https://images.pexels.com/photos/726478/pexels-photo-726478.jpeg",
  "learningMode": "species",
  "nameType": "commonName",
  "reviewMode": "flip",
  "speciesNames": [
    "Carcharodon carcharias",
    "Galeocerdo cuvier",
    "Carcharhinus leucas",
    "Carcharhinus longimanus",
    "Carcharhinus galapagensis",
    "Carcharhinus melanopterus",
    "Carcharhinus amblyrhynchos",
    "Carcharhinus falciformis",
    "Carcharhinus limbatus",
    "Triaenodon obesus",
    "Nebrius ferrugineus",
    "Ginglymostoma cirratum",
    "Stegostoma tigrinum",
    "Sphyrna lewini",
    "Sphyrna mokarran",
    "Sphyrna zygaena",
    "Rhincodon typus",
    "Cetorhinus maximus",
    "Alopias pelagicus",
    "Alopias vulpinus",
    "Mobula birostris",
    "Mobula alfredi",
    "Mobula tarapacana",
    "Rhinoptera bonasus",
    "Aetobatus narinari",
    "Dasyatis pastinaca",
    "Taeniura lymma",
    "Himantura uarnak",
    "Urobatis halleri",
    "Torpedo marmorata",
    "Raja clavata"
  ],
  "sourceId": "ab980617-8600-437d-b33c-d77c015849cf"
}
