{
  "name": "Rotesmeer - Level 1",
  "description": "Sehr häufige Arten",
  "speciesNames": [
    "Chaetodon austriacus",
    "Pycnochromis dimidiatus",
    "Pseudanthias squamipinnis",
    "Chaetodon paucifasciatus",
    "Pygoplites diacanthus",
    "Zebrasoma desjardinii",
    "Thalassoma rueppellii",
    "Paracirrhites forsteri",
    "Heniochus intermedius",
    "Amblyglyphidodon indicus",
    "Ctenochaetus striatus",
    "Myripristis murdjan",
    "Labroides dimidiatus",
    "Gomphosus caeruleus",
    "Chaetodon fasciatus",
    "Scarus ferrugineus",
    "Zebrasoma xanthurum",
    "Chlorurus sordidus",
    "Parupeneus forsskali",
    "Pseudochromis fridmani",
    "Centropyge multispinis",
    "Chaetodon auriga",
    "Pomacentrus sulfureus",
    "Scarus niger",
    "Bodianus anthioides",
    "Chromis flavaxilla",
    "Dascyllus trimaculatus",
    "Cephalopholis miniata",
    "Amphiprion bicinctus",
    "Pomacentrus trichrourus",
    "Halichoeres hortulanus",
    "Cephalopholis hemistiktos",
    "Sargocentron caudimaculatum",
    "Balistapus undulatus",
    "Chaetodon semilarvatus",
    "Caesio suevica",
    "Arothron diadematus",
    "Cephalopholis argus",
    "Naso elegans",
    "Acanthurus nigrofuscus",
    "Chaetodon melannotus",
    "Coris aygula",
    "Pseudocheilinus hexataenia",
    "Chaetodon trifascialis",
    "Parapercis hexophtalma",
    "Epibulus insidiator",
    "Chromis viridis",
    "Anampses twistii",
    "Caesio lunaris",
    "Pseudodax moluccanus",
    "Sufflamen albicaudatum",
    "Hipposcarus harid",
    "Rhinecanthus assasi",
    "Dascyllus aruanus",
    "Cheilinus quinquecinctus",
    "Abudefduf vaigiensis",
    "Pterois miles",
    "Fistularia commersonii",
    "Oxycheilinus digramma",
    "Neoniphon sammara",
    "Parupeneus cyclostomus",
    "Cheilinus lunulatus",
    "Dascyllus marginatus",
    "Priacanthus hamrur",
    "Parupeneus macronemus",
    "Pomacanthus imperator",
    "Abudefduf sexfasciatus",
    "Gymnothorax javanicus",
    "Pterois cincta",
    "Caesio striata",
    "Larabicus quadrilineatus",
    "Monotaxis grandoculis",
    "Lutjanus ehrenbergii",
    "Ostracion cyanurus",
    "Plagiotremus tapeinosoma",
    "Taeniura lymma",
    "Amblyglyphidodon flavilatus",
    "Variola louti",
    "Balistoides viridescens",
    "Pseudocheilinus evanidus",
    "Siganus luridus",
    "Acanthurus sohal",
    "Cheilinus abudjubbe",
    "Pseudochromis springeri",
    "Cheilodipterus macrodon",
    "Pomacanthus maculosus",
    "Mulloidichthys vanicolensis",
    "Naso unicornis",
    "Cheilinus undulatus",
    "Bodianus diana",
    "Macolor niger",
    "Scolopsis ghanam",
    "Chromis weberi",
    "Cirripectes castaneus",
    "Calotomus viridescens",
    "Pseudobalistes fuscus",
    "Flavocaranx bajad",
    "Sargocentron spiniferum",
    "Siganus stellatus",
    "Neopomacentrus miryae",
    "Sargocentron diadema",
    "Genicanthus caudovittatus",
    "Lutjanus bohar",
    "Anampses meleagrides",
    "Chlorurus gibbus",
    "Chaetodon lineolatus",
    "Labroides bicolor",
    "Dugong dugon",
    "Tridacna maxima",
    "Diadema setosum",
    "Holothuria atra",
    "Heteractis magnifica",
    "Stylophora pistillata"
  ],
  "imageUrl": "https://upload.wikimedia.org/wikipedia/commons/thumb/2/27/Red_Sea_37.95521E_21.41271N.jpg/330px-Red_Sea_37.95521E_21.41271N.jpg",
  "sources": [
    {
      "name": "REEF",
      "url": "https://www.reef.org/"
    },
    {
      "name": "FishBase",
      "url": "https://www.fishbase.org/"
    },
    {
      "name": "SeaLifeBase",
      "url": "https://www.sealifebase.org/"
    },
    {
      "name": "ChatGPT",
      "url": "https://openai.com/chatgpt"
    }
  ]
}