{
  "name": "Indian Ocean Red Sea - Level 2",
  "description": "Häufige Arten",
  "speciesNames": [
    "Gnathodentex aureolineatus",
    "Heniochus acuminatus",
    "Parapercis hexophtalma",
    "Parupeneus ciliatus",
    "Parupeneus cyclostomus",
    "Balistoides conspicillum",
    "Caesio xanthonota",
    "Cirrhitichthys oxycephalus",
    "Heniochus pleurotaenia",
    "Lutjanus kasmira",
    "Platax teira",
    "Pomacentrus indicus",
    "Siganus corallinus",
    "Aulostomus chinensis",
    "Chromis weberi",
    "Halichoeres scapularis",
    "Macropharyngodon bipartitus",
    "Caesio suevica",
    "Eretmochelys imbricata",
    "Heniochus intermedius",
    "Myripristis kuntee",
    "Nannocampus pictus",
    "Neoniphon sammara",
    "Parupeneus trifasciatus",
    "Platax orbicularis",
    "Scarus rubroviolaceus",
    "Acanthurus triostegus",
    "Amphiprion nigripes",
    "Anampses meleagrides",
    "Caesio lunaris",
    "Diodon liturosus",
    "Monotaxis heterodon",
    "Myripristis botche",
    "Myripristis violacea",
    "Plagiotremus rhinorhynchos",
    "Scarus ferrugineus",
    "Thalassoma hardwicke",
    "Aetobatus ocellatus",
    "Mirolabrichthys evansi",
    "Myripristis murdjan",
    "Pempheris vanicolensis",
    "Synodus variegatus",
    "Abudefduf septemfasciatus",
    "Acanthurus thompsoni",
    "Canthigaster solandri",
    "Chaetodon austriacus",
    "Chromis atripectoralis",
    "Lethrinus lentjan",
    "Novaculichthys taeniourus",
    "Parupeneus forsskali",
    "Pseudocheilinus hexataenia",
    "Acanthurus lineatus",
    "Cetoscarus ocellatus",
    "Chaetodon collare",
    "Chaetodon fasciatus",
    "Chaetodon melannotus",
    "Chaetodon triangulum",
    "Ctenochaetus binotatus",
    "Myripristis berndti",
    "Pomacentrus chrysurus",
    "Pterocaesio pisang",
    "Sargocentron seychellense",
    "Scarus frenatus",
    "Scarus tricolor",
    "Cirrhilabrus exquisitus",
    "Coris batuensis",
    "Halichoeres chrysotaenia",
    "Lutjanus monostigma",
    "Pempheris adusta",
    "Plagiotremus tapeinosoma",
    "Arothron diadematus",
    "Calotomus carolinus",
    "Cheilodipterus quinquelineatus",
    "Hipposcarus harid",
    "Leptoscarus vaigiensis",
    "Monodactylus argenteus",
    "Myripristis adusta",
    "Naso hexacanthus",
    "Oxymonacanthus longirostris",
    "Parupeneus pleurostigma",
    "Pseudodax moluccanus",
    "Thalassoma hebraicum",
    "Tylosurus crocodilus",
    "Abudefduf sordidus",
    "Acanthurus mata",
    "Amphiprion bicinctus",
    "Epinephelus fasciatus",
    "Gymnothorax griseus",
    "Kyphosus vaigiensis",
    "Meiacanthus smithi",
    "Parapercis signata",
    "Pastinachus sephen",
    "Pycnochromis flavipectoralis",
    "Acanthurus blochii",
    "Acanthurus leucocheilus",
    "Acanthurus xanthopterus",
    "Aluterus scriptus",
    "Cantherhines pardalis",
    "Chaetodon paucifasciatus",
    "Chaetodon semilarvatus",
    "Cheilinus lunulatus",
    "Corythoichthys amplexus",
    "Crenimugil crenilabis",
    "Diagramma centurio",
    "Lethrinus nebulosus",
    "Plectroglyphidodon leucozonus",
    "Plectropomus laevis",
    "Pterois cincta",
    "Scarus scaber",
    "Sphyraena barracuda",
    "Taeniura lymma",
    "Thalassoma amblycephalum",
    "Trachinotus blochii",
    "Abudefduf notatus",
    "Acanthurus tennentii",
    "Caranx ignobilis",
    "Chaetodon interruptus",
    "Chromis xutha",
    "Ferdauia ferdau",
    "Gerres oyena",
    "Gymnothorax favagineus",
    "Kyphosus cinerascens",
    "Mulloidichthys vanicolensis",
    "Pseudobalistes fuscus",
    "Pseudochromis fridmani",
    "Synanceia verrucosa",
    "Taeniamia fucata",
    "Taeniura meyeni",
    "Thalassoma rueppellii",
    "Zebrasoma xanthurum",
    "Amblyglyphidodon flavilatus",
    "Arothron hispidus",
    "Arothron meleagris",
    "Bolbometopon muricatum",
    "Carcharhinus amblyrhynchos",
    "Cetoscarus bicolor",
    "Chaetodon lineolatus",
    "Chaetodon zanzibarensis",
    "Chelonia mydas",
    "Chromis flavaxilla",
    "Ecsenius minutus",
    "Epinephelus coeruleopunctatus",
    "Epinephelus spilotoceps",
    "Heniochus monoceros",
    "Malacanthus latovittatus",
    "Naso unicornis",
    "Neoglyphidodon melas",
    "Carcharhinus longimanus",
    "Pomacanthus maculosus",
    "Pomacentrus nagasakiensis",
    "Ptereleotris heteroptera",
    "Pterocaesio marri",
    "Scarus caudofasciatus",
    "Scorpaenopsis diabolus",
    "Trachinotus baillonii",
    "Acanthaster planci",
    "Arothron nigropunctatus",
    "Bodianus anthioides",
    "Calotomus viridescens",
    "Chaetodon bennetti",
    "Diodon hystrix",
    "Forcipiger longirostris",
    "Tridacna squamosa"
  ],
  "imageUrl": "https://www.reef.org/sites/all/modules/custom/reef_zones/images/iors.jpg",
  "sources": [
    {
      "name": "REEF",
      "url": "https://www.reef.org/"
    },
    {
      "name": "FAO – Sharks and Rays of the Red Sea and Gulf of Aden (Field Identification Guide)",
      "url": "https://www.fao.org/"
    },
    {
      "name": "IUCN SSC Shark Specialist Group – Important Shark and Ray Areas (ISRA)",
      "url": "https://sharkrayareas.org/"
    },
    {
      "name": "IUCN Red List of Threatened Species",
      "url": "https://www.iucnredlist.org/"
    },
    {
      "name": "Frontiers in Marine Science",
      "url": "https://www.frontiersin.org/journals/marine-science"
    }
  ]
}