{
  "name": "Kanare Madeira Azoren - Level 1",
  "description": "Sehr häufige Arten",
  "speciesNames": [
    "Thalassoma pavo",
    "Sparisoma cretense",
    "Similiparma lurida",
    "Diplodus vulgaris",
    "Sphoeroides marmoratus",
    "Diplodus cadenati",
    "Hermodice carunculata",
    "Chromis limbata",
    "Serranus atricauda",
    "Asparagopsis taxiformis",
    "Scorpaena maderensis",
    "Holothuria sanctori",
    "Sarpa salpa",
    "Muraena augusti",
    "Apogon imberbis",
    "Ophidiaster ophidianus",
    "Arbacia lixula",
    "Ophioblennius atlanticus",
    "Sphaerechinus granularis",
    "Tripterygion delaisi",
    "Padina pavonica",
    "Mullus surmuletus",
    "Pseudocaranx dentex",
    "Boops boops",
    "Caulerpa webbiana",
    "Asparagopsis armata",
    "Corynactis viridis",
    "Distaplia corolla",
    "Coris julis",
    "Squatina squatina",
    "Caretta caretta"
  ],
  "imageUrl": "",
  "sources": [
    {
      "name": "REEF",
      "url": "https://www.reef.org/"
    },
    {
      "name": "FishBase",
      "url": "https://www.fishbase.org/"
    },
    {
      "name": "SeaLifeBase",
      "url": "https://www.sealifebase.org/"
    },
    {
      "name": "ChatGPT",
      "url": "https://openai.com/chatgpt"
    }
  ]
}