{
  "name": "Critter",
  "description": "Kleine, oft versteckte Meerestiere, die besonders bei Makro-Tauchern beliebt sind. Dazu gehören Nacktschnecken, Garnelen, Krabben und andere wirbellose Tiere, die auf Riffen, Sandböden, Seegraswiesen oder zwischen Korallen leben.",
  "imageUrl": "https://images.pexels.com/photos/8065536/pexels-photo-8065536.jpeg",
  "learningMode": "species",
  "nameType": "commonName",
  "reviewMode": "multipleChoice",
  "speciesNames": [
    "Chromodoris willani",
    "Chromodoris annae",
    "Hypselodoris bullockii",
    "Glossodoris atromarginata",
    "Phyllidia varicosa",
    "Phyllidiella pustulosa",
    "Nembrotha kubaryana",
    "Flabellina affinis",
    "Janolus cristatus",
    "Doto pinnatifida",
    "Costasiella kuroshimae",
    "Berghia stephanieae",
    "Thor amboinensis",
    "Periclimenes imperator",
    "Periclimenes yucatanicus",
    "Ancylomenes pedersoni",
    "Stenopus hispidus",
    "Lysmata amboinensis",
    "Lysmata debelius",
    "Hymenocera picta",
    "Gnathophyllum americanum",
    "Neopetrolisthes maculatus",
    "Porcellanella triloba",
    "Lybia tessellata",
    "Camposcia retusa",
    "Hoplophrys oatesii",
    "Tonna perdix",
    "Cyerce nigricans",
    "Elysia crispata"
  ],
  "sourceId": "1ac25e7b-286c-4a49-b9bc-f1eb5f5e2124"
}
