{
  "name": "Mittelmeer - Level 3",
  "description": "Seltene Arten",
  "speciesNames": [
    "Pterois miles",
    "Siganus luridus",
    "Anthias anthias",
    "Corcyrogobius liechtensteini",
    "Holothuria mammata",
    "Lipophrys trigloides",
    "Diplodus cervinus",
    "Hippocampus hippocampus",
    "Maja brachydactyla",
    "Oedalechilus labeo",
    "Parablennius gattorugine",
    "Parablennius incognitus",
    "Scorpaena notata",
    "Scorpaena porcus",
    "Trachinus radiatus",
    "Trachurus picturatus",
    "Dactylopterus volitans",
    "Labrus merula",
    "Microlipophrys nigriceps",
    "Palinurus elephas",
    "Pinna rudis",
    "Plesionika narval",
    "Serranus atricauda",
    "Symphodus bailloni",
    "Atherina hepsetus",
    "Chelon labrosus",
    "Coryphoblennius galerita",
    "Dentex dentex",
    "Gobius vittatus",
    "Parablennius ruber",
    "Parupeneus forsskali",
    "Sardina pilchardus",
    "Solea solea",
    "Symphodus cinereus",
    "Chelidonichthys obscurus",
    "Fistularia commersonii",
    "Gobius bucchichi",
    "Gobius couchi",
    "Gobius paganellus",
    "Gobius roulei",
    "Gymnothorax unicolor",
    "Marthasterias glacialis",
    "Mullus barbatus",
    "Pagrus pagrus",
    "Parablennius pilicornis",
    "Parablennius tentacularis",
    "Parablennius zvonimiri",
    "Pomatoschistus bathi",
    "Sargocentron rubrum",
    "Aidablennius sphynx",
    "Asparagopsis taxiformis",
    "Atherina boyeri",
    "Chelonia mydas",
    "Corynactis viridis",
    "Dasyatis pastinaca",
    "Engraulis encrasicolus",
    "Felimare picta",
    "Gammogobius steinitzi",
    "Gobius xanthocephalus",
    "Gongolaria abies-marina",
    "Labrus bergylta",
    "Microchirus azevia",
    "Microlipophrys canevae",
    "Pelagia noctiluca",
    "Sciaena umbra",
    "Scophthalmus maximus",
    "Seriola fasciata",
    "Siganus rivulatus",
    "Similiparma lurida",
    "Sphyraena sphyraena",
    "Symphodus caeruleus",
    "Syngnathus abaster",
    "Torpedo marmorata",
    "Torpedo torpedo",
    "Scyliorhinus canicula",
    "Mycteroperca rubra",
    "Stephanolepis diaspros",
    "Sphyraena chrysotaenia"
  ],
  "imageUrl": "https://images.pexels.com/photos/1200289/pexels-photo-1200289.jpeg",
  "sources": [
    {
      "name": "REEF",
      "url": "https://www.reef.org/"
    }
  ]
}