{
  "name": "Indischer Ozean: Malediven, Madagaskar, Seychellen - Level 1",
  "description": "Reef: IORS Regions 2 and 6",
  "speciesNames": [
    "Zanclus cornutus",
    "Labroides dimidiatus",
    "Balistapus undulatus",
    "Pseudanthias squamipinnis",
    "Halichoeres hortulanus",
    "Odonus niger",
    "Chaetodon kleinii",
    "Centropyge multispinis",
    "Chlorurus sordidus",
    "Chaetodon trifasciatus",
    "Pycnochromis fieldi",
    "Cephalophlis rogaa",
    "Forcipiger flavissimus",
    "Chaetodon guttatissimus",
    "Thalassoma lunare",
    "Acanthurus leucosternon",
    "Pomacentrus xanthocercus",
    "Sufflamen bursa",
    "Parupeneus macronemus",
    "Gomphosus caeruleus",
    "Melichthys indicus",
    "Pomacentrus indicus",
    "Hemitaurichthys zoster",
    "Pygoplites diacanthus",
    "Cephalopholis miniata",
    "Pomacanthus imperator",
    "Dascyllus carneus",
    "Zebrasoma scopas",
    "Cephalopholis argus",
    "Scolopsis bilineata",
    "Plectorhinchus vittatus",
    "Dascyllus trimaculatus",
    "Ctenochaetus striatus",
    "Pomacentrus caeruleus",
    "Amphiprion clarkii",
    "Paracirrhites forsteri",
    "Zebrasoma desjardinii",
    "Heniochus pleurotaenia",
    "Naso vlamingii",
    "Thalassoma amblycephalum",
    "Bodianus diana",
    "Sargocentron caudimaculatum",
    "Acanthurus thompsoni",
    "Canthigaster valentini",
    "Naso elegans",
    "Acanthurus nigricauda",
    "Amphiprion nigripes",
    "Apolemichthys trimaculatus",
    "Pseudocheilinus hexataenia",
    "Pterocaesio tile",
    "Balistoides conspicillum",
    "Mirolabrichthys evansi",
    "Ptereleotris evides",
    "Chaetodon falcula",
    "Monotaxis heterodon",
    "Chaetodon auriga",
    "Monotaxis grandoculis",
    "Chromis ternatensis",
    "Parupeneus barberinus",
    "Scarus niger",
    "Cirrhilabrus exquisitus",
    "Balistoides viridescens",
    "Caesio xanthonota",
    "Caranx melampygus",
    "Gymnothorax javanicus",
    "Labroides bicolor",
    "Bodianus axillaris",
    "Chromis weberi",
    "Myripristis vittata",
    "Naso hexacanthus",
    "Sufflamen chrysopterum",
    "Sargocentron spiniferum",
    "Chaetodon meyeri",
    "Cephalopholis leopardus",
    "Chaetodon madagaskariensis",
    "Chromis viridis",
    "Cephalopholis nigripinnis",
    "Cirrhitichthys oxycephalus",
    "Nemateleotris magnifica",
    "Macropharyngodon bipartitus",
    "Chaetodon xanthocephalus",
    "Pomacentrus pavo",
    "Dascyllus aruanus",
    "Macolor macularis",
    "Naso brevirostris",
    "Thalassoma hardwicke",
    "Chlorurus strongylocephalus",
    "Fistularia commersonii",
    "Siganus stellatus",
    "Lutjanus gibbus",
    "Pomacentrus chrysurus",
    "Ctenochaetus binotatus",
    "Hemigymnus fasciatus",
    "Chaetodon collare",
    "Halichoeres leucoxanthus",
    "Lutjanus kasmira",
    "Variola louti",
    "Lutjanus bohar",
    "Scarus rubroviolaceus",
    "Pseudodax moluccanus",
    "Stegastes lacrymatus",
    "Ecsenius minutus",
    "Ctenochaetus truncatus",
    "Anyperodon leucogrammicus",
    "Triaenodon obesus",
    "Chaetodon triangulum",
    "Parapercis signata",
    "Plagiotremus rhinorhynchos",
    "Scarus tricolor",
    "Anampses meleagrides",
    "Eviota mikiae",
    "Halichoeres cosmetus",
    "Scarus frenatus",
    "Platax teira",
    "Arothron nigropunctatus",
    "Ostracion cubicum",
    "Pterocaesio pisang",
    "Forcipiger longirostris",
    "Gnathodentex aureolineatus",
    "Oxycheilinus digramma",
    "Parupeneus trifasciatus",
    "Pterois antennata",
    "Pomacanthus xanthometopon",
    "Myripristis violacea",
    "Cheilodipterus macrodon",
    "Coris batuensis",
    "Paracirrhites arcatus",
    "Caesio lunaris",
    "Caesio varilineata",
    "Eviota sebreei",
    "Myripristis kuntee",
    "Cetoscarus ocellatus",
    "Ecsenius bicolor",
    "Lutjanus monostigma",
    "Abudefduf vaigiensis",
    "Acanthurus nigrofuscus",
    "Amblyglyphidodon indicus",
    "Chaetodon trifascialis",
    "Helcogramma maldivensis",
    "Ostorhinchus nigrofasciatus",
    "Parapercis millepunctata",
    "Myripristis berndti",
    "Diodon liturosus",
    "Heniochus acuminatus",
    "Heniochus diphreutes",
    "Scarus psittacus",
    "Hipposcarus harid",
    "Plagiotremus tapeinosoma",
    "Cephalopholis sexmaculata",
    "Chromis xutha",
    "Carcharhinus amblyrhynchos",
    "Myripristis adusta",
    "Mobula alfredi",
    "Chelonia mydas",
    "Eretmochelys imbricata",
    "Carcharhinus melanopterus",
    "Nebrius ferrugineus",
    "Taeniura lymma",
    "Tridacna gigas",
    "Diadema setosum",
    "Holothuria atra",
    "Heteractis magnifica",
    "Stichodactyla gigantea",
    "Phyllidia varicosa",
    "Acropora muricata"
  ],
  "imageUrl": "https://upload.wikimedia.org/wikipedia/commons/e/eb/1_Maldives%2C_Indian_Ocean%2C_Asia.jpg",
  "sources": [
    {
      "name": "REEF",
      "url": "https://www.reef.org/"
    },
    {
      "name": "FishBase",
      "url": "https://www.fishbase.org/"
    },
    {
      "name": "SeaLifeBase",
      "url": "https://www.sealifebase.org/"
    },
    {
      "name": "ChatGPT",
      "url": "https://openai.com/chatgpt"
    }
  ],
  "createdBy": "Fabian Eberle"
}