{
  "name": "Switzerland Fish - Level 3",
  "description": "Experten: seltene, endemische oder schwer unterscheidbare Arten",
  "imageUrl": "https://publicdomainvectors.org/photos/Switzerland-Map-Flag.png",
  "speciesNames": [
    "Coregonus albellus",
    "Coregonus alpinus",
    "Coregonus arenicolus",
    "Coregonus confusus",
    "Coregonus duplex",
    "Coregonus fatioi",
    "Coregonus heglingus",
    "Coregonus hiemalis",
    "Coregonus lavaretus",
    "Coregonus macrophthalmus",
    "Coregonus nobilis",
    "Coregonus oxyrinchus",
    "Coregonus palaea",
    "Coregonus suidteri",
    "Coregonus wartmanni",
    "Coregonus zuerichensis",
    "Coregonus zugensis",
    "Lampetra planeri",
    "Lampetra fluviatilis",
    "Lampetra zanandreai",
    "Salmo salar",
    "Salmo cenerinus",
    "Salmo rhodanensis",
    "Salmo labrax",
    "Salmo marmoratus",
    "Salvelinus neocomensis",
    "Salvelinus profundus",
    "Thymallus aeliani",
    "Chondrostoma soetta",
    "Barbus caninus",
    "Barbus plebejus",
    "Rutilus pigus",
    "Leucos aula",
    "Squalius squalus",
    "Telestes muticellus",
    "Cobitis bilineata",
    "Sabanejewia larvata",
    "Phoxinus lumaireul",
    "Romanogobio benacensis",
    "Romanogobio uranoscopus",
    "Gobio obtusirostris",
    "Parachondrostoma toxostoma",
    "Padogobius bonelli",
    "Alburnus chalcoides",
    "Leuciscus aspius",
    "Esox cisalpinus",
    "Scardinius hesperidicus",
    "Barbus meridionalis",
    "Misgurnus fossilis",
    "Cobitis taenia",
    "Acipenser sturio",
    "Alosa agone",
    "Alosa alosa",
    "Alosa fallax",
    "Salariopsis fluviatilis",
    "Zingel asper",
    "Cottus perifretum"
  ],
  "sources": [
    {
      "name": "BAFU (Bundesamt für Umwelt)",
      "url": "https://www.bafu.admin.ch/"
    },
    {
      "name": "FishBase",
      "url": "https://www.fishbase.se/"
    }
  ],
  "sourceId": "1a44f5c9-eed4-4b35-bf4a-2b0f7d175af7"
}
